{
    "$schema": "https://json-schema.org/draft-07/schema#",
    "type": "array",
    "items": {
        "type": "object",
        "properties": {
            "p": {
                "type": "string",
                "description": "MensaMax project (\"Projekt\") for this canteen.",
                "examples": ["N111"]
            },
            "e": {
                "type": "string",
                "description": "MensaMax institution (\"Einrichtung\") for this canteen.",
                "examples": ["Mensa"]
            },
            "provider": {
                "type": "string",
                "description": "MensaMax provider this canteen is on (MensaMax has some distinct systems under different URLs).",
                "examples": [
                    "mensadigital.de",
                    "mensaservice.de",
                    "mensaonline.de",
                    "mensapoint.de",
                    "mensahome.de",
                    "mensaland.de",
                    "mensaweb.de",
                    "mensawelten.de",
                    "mensacity.de",
                    "mensaoffice.de",
                    "mammasmensa.de",
                    "mensalokal.de",
                    "mensastadt.de",
                    "mensahaus.de",
                    "parentsmensa.de",
                    "mensaaktiv.de",
                    "mensacenter.de",
                    "app.mensamax.de"
                ],
                "not": {
                    "type": "string",
                    "description": "This MensaMax provider is unsupported.",
                    "pattern": "^mensa365.de$"
                }
            },
            "name": {
                "type": "string",
                "description": "Human-readable name for the canteen (optional)."
            },
            "$comment": {
                "type": "string",
                "description": "Any notes for this canteen."
            },
            "om_id":{
                "type": "integer",
                "description": "ID of the canteen in OpenMensa if already created there."
            },
            "loc":{
                "type": "string",
                "description": "Location of the canteen (e.g. name of city/village/...)"
            }
        },
        "required": ["p", "e", "provider"],
        "additionalProperties": false
    },
    "additionalItems": false,
    "uniqueItems": true
}
